{
  "index_id": "sha256:ffffffffffffffffffffffffffffffffffffffffffffffffffffffffffffffff",
  "protocol": "qsol-control-search-index/1",
  "kind": "deterministic-lexical-baseline",
  "engine": "qsol.term-frequency-cosine/1",
  "collection_id": "sha256:cccccccccccccccccccccccccccccccccccccccccccccccccccccccccccccccc",
  "snapshot_id": "sha256:dddddddddddddddddddddddddddddddddddddddddddddddddddddddddddddddd",
  "built_at": "2026-08-18T07:46:00+09:30",
  "derived": true,
  "rebuildable": true,
  "authority": "none",
  "documents": {
    "sha256:aaaaaaaaaaaaaaaaaaaaaaaaaaaaaaaaaaaaaaaaaaaaaaaaaaaaaaaaaaaaaaaa": {
      "quantum": 2,
      "evidence": 1
    }
  },
  "skipped_file_ids": []
}
